{"run_id":"R-20260422-001","stage":"VERIFYING","agent_active":"fg-505-build-verifier","elapsed_ms_in_stage":42310,"timeout_ms":600000,"last_event":{"ts":"2026-04-22T11:03:14.212Z","type":"agent_dispatch","detail":"fg-505 started"},"next_expected_at":"2026-04-22T11:13:14Z","updated_at":"2026-04-22T11:03:16.844Z","writer":"post_tool_use_agent.py"}
